{
  "$schema": "https://json-schema.org/draft/2020-12/schema",
  "$id": "https://github.com/grokify/prism/schema/prism.schema.json",
  "$ref": "#/$defs/PRISMDocument",
  "$defs": {
    "CustomerAwarenessConfig": {
      "properties": {
        "enabled": {
          "type": "boolean"
        },
        "states": {
          "items": {
            "type": "string"
          },
          "type": "array"
        }
      },
      "additionalProperties": false,
      "type": "object",
      "required": [
        "enabled"
      ]
    },
    "DMAICMapping": {
      "properties": {
        "define": {
          "type": "string"
        },
        "measure": {
          "type": "string"
        },
        "analyze": {
          "type": "string"
        },
        "improve": {
          "type": "string"
        },
        "control": {
          "type": "string"
        }
      },
      "additionalProperties": false,
      "type": "object"
    },
    "DataPoint": {
      "properties": {
        "timestamp": {
          "type": "string",
          "format": "date-time"
        },
        "value": {
          "type": "number"
        },
        "note": {
          "type": "string"
        }
      },
      "additionalProperties": false,
      "type": "object",
      "required": [
        "timestamp",
        "value"
      ]
    },
    "DeploymentStatus": {
      "properties": {
        "status": {
          "type": "string"
        },
        "totalCustomers": {
          "type": "integer"
        },
        "deployedCustomers": {
          "type": "integer"
        },
        "adoptionPercent": {
          "type": "number"
        }
      },
      "additionalProperties": false,
      "type": "object",
      "required": [
        "status"
      ]
    },
    "DomainDef": {
      "properties": {
        "name": {
          "type": "string"
        },
        "description": {
          "type": "string"
        },
        "weight": {
          "type": "number"
        }
      },
      "additionalProperties": false,
      "type": "object",
      "required": [
        "name"
      ]
    },
    "FrameworkMapping": {
      "properties": {
        "framework": {
          "type": "string"
        },
        "reference": {
          "type": "string"
        }
      },
      "additionalProperties": false,
      "type": "object",
      "required": [
        "framework",
        "reference"
      ]
    },
    "Goal": {
      "properties": {
        "id": {
          "type": "string"
        },
        "name": {
          "type": "string"
        },
        "description": {
          "type": "string"
        },
        "owner": {
          "type": "string"
        },
        "priority": {
          "type": "integer"
        },
        "status": {
          "type": "string"
        },
        "startDate": {
          "type": "string"
        },
        "targetDate": {
          "type": "string"
        },
        "maturityModel": {
          "$ref": "#/$defs/GoalMaturityModel"
        },
        "currentLevel": {
          "type": "integer"
        },
        "targetLevel": {
          "type": "integer"
        }
      },
      "additionalProperties": false,
      "type": "object",
      "required": [
        "name"
      ]
    },
    "GoalMaturityLevel": {
      "properties": {
        "level": {
          "type": "integer"
        },
        "name": {
          "type": "string"
        },
        "description": {
          "type": "string"
        },
        "requiredSLOs": {
          "items": {
            "$ref": "#/$defs/SLORequirement"
          },
          "type": "array"
        },
        "metricCriteria": {
          "items": {
            "$ref": "#/$defs/MetricCriterion"
          },
          "type": "array"
        }
      },
      "additionalProperties": false,
      "type": "object",
      "required": [
        "level",
        "name"
      ]
    },
    "GoalMaturityModel": {
      "properties": {
        "levels": {
          "items": {
            "$ref": "#/$defs/GoalMaturityLevel"
          },
          "type": "array"
        }
      },
      "additionalProperties": false,
      "type": "object",
      "required": [
        "levels"
      ]
    },
    "GoldenSignal": {
      "properties": {
        "latency": {
          "type": "string"
        },
        "traffic": {
          "type": "string"
        },
        "errors": {
          "type": "string"
        },
        "saturation": {
          "type": "string"
        }
      },
      "additionalProperties": false,
      "type": "object"
    },
    "Initiative": {
      "properties": {
        "id": {
          "type": "string"
        },
        "name": {
          "type": "string"
        },
        "description": {
          "type": "string"
        },
        "status": {
          "type": "string"
        },
        "priority": {
          "type": "integer"
        },
        "metricIds": {
          "items": {
            "type": "string"
          },
          "type": "array"
        },
        "owner": {
          "type": "string"
        },
        "team": {
          "type": "string"
        },
        "dependentTeams": {
          "items": {
            "type": "string"
          },
          "type": "array"
        },
        "startDate": {
          "type": "string"
        },
        "endDate": {
          "type": "string"
        },
        "goalIds": {
          "items": {
            "type": "string"
          },
          "type": "array"
        },
        "phaseId": {
          "type": "string"
        },
        "devCompletionPercent": {
          "type": "number"
        },
        "deploymentStatus": {
          "$ref": "#/$defs/DeploymentStatus"
        },
        "serviceId": {
          "type": "string"
        }
      },
      "additionalProperties": false,
      "type": "object",
      "required": [
        "name"
      ]
    },
    "LayerDef": {
      "properties": {
        "id": {
          "type": "string"
        },
        "name": {
          "type": "string"
        },
        "description": {
          "type": "string"
        },
        "weight": {
          "type": "number"
        },
        "signals": {
          "$ref": "#/$defs/GoldenSignal"
        }
      },
      "additionalProperties": false,
      "type": "object",
      "required": [
        "id",
        "name"
      ]
    },
    "MaturityCell": {
      "properties": {
        "domain": {
          "type": "string"
        },
        "stage": {
          "type": "string"
        },
        "currentLevel": {
          "type": "integer"
        },
        "targetLevel": {
          "type": "integer"
        },
        "primaryKPI": {
          "type": "string"
        },
        "kpiTarget": {
          "type": "string"
        },
        "maturityScore": {
          "type": "number"
        }
      },
      "additionalProperties": false,
      "type": "object",
      "required": [
        "domain",
        "stage",
        "currentLevel"
      ]
    },
    "MaturityLevelDef": {
      "properties": {
        "level": {
          "type": "integer"
        },
        "name": {
          "type": "string"
        },
        "description": {
          "type": "string"
        }
      },
      "additionalProperties": false,
      "type": "object",
      "required": [
        "level",
        "name"
      ]
    },
    "MaturityMapping": {
      "properties": {
        "level1": {
          "type": "string"
        },
        "level2": {
          "type": "string"
        },
        "level3": {
          "type": "string"
        },
        "level4": {
          "type": "string"
        },
        "level5": {
          "type": "string"
        }
      },
      "additionalProperties": false,
      "type": "object"
    },
    "MaturityModel": {
      "properties": {
        "levels": {
          "items": {
            "$ref": "#/$defs/MaturityLevelDef"
          },
          "type": "array"
        },
        "cells": {
          "items": {
            "$ref": "#/$defs/MaturityCell"
          },
          "type": "array"
        }
      },
      "additionalProperties": false,
      "type": "object"
    },
    "Metadata": {
      "properties": {
        "name": {
          "type": "string"
        },
        "description": {
          "type": "string"
        },
        "version": {
          "type": "string"
        },
        "author": {
          "type": "string"
        },
        "created": {
          "type": "string"
        },
        "updated": {
          "type": "string"
        }
      },
      "additionalProperties": false,
      "type": "object"
    },
    "Metric": {
      "properties": {
        "id": {
          "type": "string"
        },
        "name": {
          "type": "string"
        },
        "description": {
          "type": "string"
        },
        "domain": {
          "type": "string"
        },
        "stage": {
          "type": "string"
        },
        "category": {
          "type": "string"
        },
        "layer": {
          "type": "string"
        },
        "qualityVertical": {
          "type": "string"
        },
        "metricType": {
          "type": "string"
        },
        "trendDirection": {
          "type": "string"
        },
        "unit": {
          "type": "string"
        },
        "baseline": {
          "type": "number"
        },
        "current": {
          "type": "number"
        },
        "target": {
          "type": "number"
        },
        "sli": {
          "$ref": "#/$defs/SLI"
        },
        "slo": {
          "$ref": "#/$defs/SLO"
        },
        "thresholds": {
          "$ref": "#/$defs/Thresholds"
        },
        "status": {
          "type": "string"
        },
        "maturityMapping": {
          "$ref": "#/$defs/MaturityMapping"
        },
        "dmaic": {
          "$ref": "#/$defs/DMAICMapping"
        },
        "customerAwareness": {
          "$ref": "#/$defs/CustomerAwarenessConfig"
        },
        "frameworkMappings": {
          "items": {
            "$ref": "#/$defs/FrameworkMapping"
          },
          "type": "array"
        },
        "owner": {
          "type": "string"
        },
        "dataSource": {
          "type": "string"
        },
        "serviceId": {
          "type": "string"
        },
        "dataPoints": {
          "items": {
            "$ref": "#/$defs/DataPoint"
          },
          "type": "array"
        }
      },
      "additionalProperties": false,
      "type": "object",
      "required": [
        "name",
        "domain",
        "stage",
        "category",
        "metricType",
        "baseline",
        "current",
        "target"
      ]
    },
    "MetricCriterion": {
      "properties": {
        "metricId": {
          "type": "string"
        },
        "operator": {
          "type": "string"
        },
        "value": {
          "type": "number"
        }
      },
      "additionalProperties": false,
      "type": "object",
      "required": [
        "metricId",
        "operator",
        "value"
      ]
    },
    "OKRMapping": {
      "properties": {
        "objectiveId": {
          "type": "string"
        },
        "objectiveName": {
          "type": "string"
        },
        "keyResultId": {
          "type": "string"
        },
        "keyResultName": {
          "type": "string"
        },
        "metricIds": {
          "items": {
            "type": "string"
          },
          "type": "array"
        }
      },
      "additionalProperties": false,
      "type": "object",
      "required": [
        "objectiveName"
      ]
    },
    "PRISMDocument": {
      "properties": {
        "$schema": {
          "type": "string"
        },
        "metadata": {
          "$ref": "#/$defs/Metadata"
        },
        "domains": {
          "items": {
            "$ref": "#/$defs/DomainDef"
          },
          "type": "array"
        },
        "layers": {
          "items": {
            "$ref": "#/$defs/LayerDef"
          },
          "type": "array"
        },
        "teams": {
          "items": {
            "$ref": "#/$defs/Team"
          },
          "type": "array"
        },
        "services": {
          "items": {
            "$ref": "#/$defs/Service"
          },
          "type": "array"
        },
        "metrics": {
          "items": {
            "$ref": "#/$defs/Metric"
          },
          "type": "array"
        },
        "maturity": {
          "$ref": "#/$defs/MaturityModel"
        },
        "okrs": {
          "items": {
            "$ref": "#/$defs/OKRMapping"
          },
          "type": "array"
        },
        "initiatives": {
          "items": {
            "$ref": "#/$defs/Initiative"
          },
          "type": "array"
        },
        "goals": {
          "items": {
            "$ref": "#/$defs/Goal"
          },
          "type": "array"
        },
        "phases": {
          "items": {
            "$ref": "#/$defs/Phase"
          },
          "type": "array"
        },
        "roadmap": {
          "$ref": "#/$defs/RoadmapConfig"
        }
      },
      "additionalProperties": false,
      "type": "object",
      "required": [
        "metrics"
      ]
    },
    "Phase": {
      "properties": {
        "id": {
          "type": "string"
        },
        "name": {
          "type": "string"
        },
        "quarter": {
          "type": "string"
        },
        "year": {
          "type": "integer"
        },
        "startDate": {
          "type": "string"
        },
        "endDate": {
          "type": "string"
        },
        "status": {
          "type": "string"
        },
        "goalTargets": {
          "items": {
            "$ref": "#/$defs/PhaseGoalTarget"
          },
          "type": "array"
        },
        "swimlanes": {
          "items": {
            "$ref": "#/$defs/Swimlane"
          },
          "type": "array"
        }
      },
      "additionalProperties": false,
      "type": "object",
      "required": [
        "name",
        "startDate",
        "endDate"
      ]
    },
    "PhaseGoalTarget": {
      "properties": {
        "goalId": {
          "type": "string"
        },
        "enterLevel": {
          "type": "integer"
        },
        "exitLevel": {
          "type": "integer"
        }
      },
      "additionalProperties": false,
      "type": "object",
      "required": [
        "goalId",
        "enterLevel",
        "exitLevel"
      ]
    },
    "RoadmapConfig": {
      "properties": {
        "name": {
          "type": "string"
        },
        "description": {
          "type": "string"
        },
        "fiscalYearStart": {
          "type": "integer"
        }
      },
      "additionalProperties": false,
      "type": "object"
    },
    "SLI": {
      "properties": {
        "name": {
          "type": "string"
        },
        "description": {
          "type": "string"
        },
        "formula": {
          "type": "string"
        }
      },
      "additionalProperties": false,
      "type": "object"
    },
    "SLO": {
      "properties": {
        "target": {
          "type": "string"
        },
        "operator": {
          "type": "string"
        },
        "value": {
          "type": "number"
        },
        "window": {
          "type": "string"
        },
        "thresholds": {
          "$ref": "#/$defs/Thresholds"
        }
      },
      "additionalProperties": false,
      "type": "object",
      "required": [
        "target"
      ]
    },
    "SLORequirement": {
      "properties": {
        "metricId": {
          "type": "string"
        },
        "description": {
          "type": "string"
        }
      },
      "additionalProperties": false,
      "type": "object",
      "required": [
        "metricId"
      ]
    },
    "Service": {
      "properties": {
        "id": {
          "type": "string"
        },
        "name": {
          "type": "string"
        },
        "description": {
          "type": "string"
        },
        "ownerTeamId": {
          "type": "string"
        },
        "layerId": {
          "type": "string"
        },
        "metricIds": {
          "items": {
            "type": "string"
          },
          "type": "array"
        },
        "repository": {
          "type": "string"
        },
        "tier": {
          "type": "string"
        }
      },
      "additionalProperties": false,
      "type": "object",
      "required": [
        "id",
        "name"
      ]
    },
    "Swimlane": {
      "properties": {
        "id": {
          "type": "string"
        },
        "name": {
          "type": "string"
        },
        "domain": {
          "type": "string"
        },
        "stage": {
          "type": "string"
        },
        "initiativeIds": {
          "items": {
            "type": "string"
          },
          "type": "array"
        }
      },
      "additionalProperties": false,
      "type": "object",
      "required": [
        "name",
        "initiativeIds"
      ]
    },
    "Team": {
      "properties": {
        "id": {
          "type": "string"
        },
        "name": {
          "type": "string"
        },
        "description": {
          "type": "string"
        },
        "type": {
          "type": "string"
        },
        "domain": {
          "type": "string"
        },
        "layerAccountability": {
          "items": {
            "type": "string"
          },
          "type": "array"
        },
        "serviceIds": {
          "items": {
            "type": "string"
          },
          "type": "array"
        },
        "owner": {
          "type": "string"
        },
        "slack": {
          "type": "string"
        },
        "email": {
          "type": "string"
        }
      },
      "additionalProperties": false,
      "type": "object",
      "required": [
        "id",
        "name",
        "type"
      ]
    },
    "Thresholds": {
      "properties": {
        "green": {
          "type": "number"
        },
        "yellow": {
          "type": "number"
        },
        "red": {
          "type": "number"
        }
      },
      "additionalProperties": false,
      "type": "object",
      "required": [
        "green",
        "yellow",
        "red"
      ]
    }
  },
  "title": "PRISM Document",
  "description": "PRISM (Proactive Reliability \u0026 Security Maturity Model) document schema"
}